chapter,chain_indx,text_ar,text_en
Rubbing hands and feet with dust (Tayammum) - كتاب التيمم,"30204, 20317, 11060, 11353","حدثنا عمر بن حفص، قال حدثنا أبي قال، حدثنا الأعمش، قال سمعت شقيق بن سلمة، قال كنت عند عبد الله وأبي موسى فقال له أبو موسى أرأيت يا أبا عبد الرحمن إذا أجنب فلم يجد، ماء كيف يصنع فقال عبد الله لا يصلي حتى يجد الماء‏.‏ فقال أبو موسى فكيف تصنع بقول عمار حين قال له النبي صلى الله عليه وسلم ‏""‏ كان يكفيك ‏""‏ قال ألم تر عمر لم يقنع بذلك‏.‏ فقال أبو موسى فدعنا من قول عمار، كيف تصنع بهذه الآية فما درى عبد الله ما يقول فقال إنا لو رخصنا لهم في هذا لأوشك إذا برد على أحدهم الماء أن يدعه ويتيمم‏.‏ فقلت لشقيق فإنما كره عبد الله لهذا قال نعم‏.‏"," Narrated Shaqiq bin Salama:                     I was with `Abdullah and Abu Musa; the latter asked the former, ""O Abu `Abdur-Rahman! What is your opinion if somebody becomes Junub and no water is available?"" `Abdullah replied, ""Do not pray till water is found."" Abu Musa said, ""What do you say about the statement of `Ammar (who was ordered by the Prophet to perform Tayammum). The Prophet said to him: ""Perform Tayammum and that would be sufficient."" `Abdullah replied, ""Don't you see that `Umar was not satisfied by `Ammar's statement?"" Abu- Musa said, ""All right, leave `Ammar's statement, but what will you say about this verse (of Tayammum)?"" `Abdullah kept quiet and then said, ""If we allowed it, then they would probably perform Tayammum even if water was available, if one of them found it (water) cold."" The narrator added, ""I said to Shaqiq, ""Then did `Abdullah dislike to perform Tayammum because of this?"" He replied, ""Yes."""
Rubbing hands and feet with dust (Tayammum) - كتاب التيمم,"30376, 20354, 11060, 11353","حدثنا محمد بن سلام، قال أخبرنا أبو معاوية، عن الأعمش، عن شقيق، قال كنت جالسا مع عبد الله وأبي موسى الأشعري فقال له أبو موسى لو أن رجلا أجنب، فلم يجد الماء شهرا، أما كان يتيمم ويصلي فكيف تصنعون بهذه الآية في سورة المائدة ‏{‏فلم تجدوا ماء فتيمموا صعيدا طيبا‏}‏ فقال عبد الله لو رخص لهم في هذا لأوشكوا إذا برد عليهم الماء أن يتيمموا الصعيد‏.‏ قلت وإنما كرهتم هذا لذا قال نعم‏.‏ فقال أبو موسى ألم تسمع قول عمار لعمر بعثني رسول الله صلى الله عليه وسلم في حاجة فأجنبت، فلم أجد الماء، فتمرغت في الصعيد كما تمرغ الدابة، فذكرت ذلك للنبي صلى الله عليه وسلم فقال ‏""‏ إنما كان يكفيك أن تصنع هكذا ‏""‏‏.‏ فضرب بكفه ضربة على الأرض ثم نفضها، ثم مسح بها ظهر كفه بشماله، أو ظهر شماله بكفه، ثم مسح بهما وجهه فقال عبد الله أفلم تر عمر لم يقنع بقول عمار وزاد يعلى عن الأعمش عن شقيق كنت مع عبد الله وأبي موسى فقال أبو موسى ألم تسمع قول عمار لعمر إن رسول الله صلى الله عليه وسلم بعثني أنا وأنت فأجنبت فتمعكت بالصعيد، فأتينا رسول الله صلى الله عليه وسلم فأخبرناه فقال ‏""‏ إنما كان يكفيك هكذا ‏""‏‏.‏ ومسح وجهه وكفيه واحدة"," Narrated Al-A`mash:                     Shaqiq said, ""While I was sitting with `Abdullah and Abu Musa Al-Ash`ari, the latter asked the former, 'If a person becomes Junub and does not find water for one month, can he perform Tayammum and offer his prayer?' (He applied in the negative). Abu Musa said, 'What do you say about this verse from Sura ""Al-Ma'ida"": When you do not find water then perform Tayammum with clean earth? `Abdullah replied, 'If we allowed it then they would probably perform Tayammum with clean earth even if water were available but cold.' I said to Shaqiq, 'You then disliked to perform Tayammum because of this?' Shaqiq said, 'Yes.' (Shaqiq added), ""Abu Musa said, 'Haven't you heard the statement of `Ammar to `Umar? He said: I was sent out by Allah's Apostle for some job and I became Junub and could not find water so I rolled myself over the dust (clean earth) like an animal does, and when I told the Prophet of that he said, 'Like this would have been sufficient.' The Prophet (saying so) lightly stroked the earth with his hand once and blew it off, then passed his (left) hand over the back of his right hand or his (right) hand over the back of his left hand and then passed them over his face.' So `Abdullah said to Abu- Musa, 'Don't you know that `Umar was not satisfied with `Ammar's statement?' "" Narrated Shaqiq: While I was with `Abdullah and Abu Musa, the latter said to the former, ""Haven't you heard the statement of `Ammar to `Umar? He said, ""Allah's Apostle sent you and me out and I became Junub and rolled myself in the dust (clean earth) (for Tayammum). When we came to Allah's Apostle I told him about it and he said, 'This would have been sufficient,' passing his hands over his face and the backs of his hands once only.' """
Rubbing hands and feet with dust (Tayammum) - كتاب التيمم,"30349, 20025, 11298, 11440, 123","حدثنا عبدان، قال أخبرنا عبد الله، قال أخبرنا عوف، عن أبي رجاء، قال حدثنا عمران بن حصين الخزاعي، أن رسول الله صلى الله عليه وسلم رأى رجلا معتزلا لم يصل في القوم فقال ‏""‏ يا فلان ما منعك أن تصلي في القوم ‏""‏‏.‏ فقال يا رسول الله، أصابتني جنابة ولا ماء‏.‏ قال ‏""‏ عليك بالصعيد فإنه يكفيك ‏""‏‏.‏"," Narrated `Imran bin Husain Al-Khuza`i:                     Allah's Apostle saw a person sitting aloof and not praying with the people. He asked him, ""O so and so! What prevented you from offering the prayer with the people?"" He replied, ""O Allah's Apostle! I am Junub and there is no water."" The Prophet said, ""Perform Tayammum with clean earth and that will be sufficient for you."""
Prayers (Salat) - كتاب الصلاة,"30399, 20023, 20475, 11013, 19, 23","حدثنا يحيى بن بكير، قال حدثنا الليث، عن يونس، عن ابن شهاب، عن أنس بن مالك، قال كان أبو ذر يحدث أن رسول الله صلى الله عليه وسلم قال ‏""‏ فرج عن سقف بيتي وأنا بمكة، فنزل جبريل ففرج صدري، ثم غسله بماء زمزم، ثم جاء بطست من ذهب ممتلئ حكمة وإيمانا، فأفرغه في صدري ثم أطبقه، ثم أخذ بيدي فعرج بي إلى السماء الدنيا، فلما جئت إلى السماء الدنيا قال جبريل لخازن السماء افتح‏.‏ قال من هذا قال هذا جبريل‏.‏ قال هل معك أحد قال نعم معي محمد صلى الله عليه وسلم‏.‏ فقال أرسل إليه قال نعم‏.‏ فلما فتح علونا السماء الدنيا، فإذا رجل قاعد على يمينه أسودة وعلى يساره أسودة، إذا نظر قبل يمينه ضحك، وإذا نظر قبل يساره بكى، فقال مرحبا بالنبي الصالح والابن الصالح‏.‏ قلت لجبريل من هذا قال هذا آدم‏.‏ وهذه الأسودة عن يمينه وشماله نسم بنيه، فأهل اليمين منهم أهل الجنة، والأسودة التي عن شماله أهل النار، فإذا نظر عن يمينه ضحك، وإذا نظر قبل شماله بكى، حتى عرج بي إلى السماء الثانية فقال لخازنها افتح‏.‏ فقال له خازنها مثل ما قال الأول ففتح ‏""‏‏.‏ قال أنس فذكر أنه وجد في السموات آدم وإدريس وموسى وعيسى وإبراهيم  صلوات الله عليهم  ولم يثبت كيف منازلهم، غير أنه ذكر أنه وجد آدم في السماء الدنيا، وإبراهيم في السماء السادسة‏.‏ قال أنس فلما مر جبريل بالنبي صلى الله عليه وسلم بإدريس قال مرحبا بالنبي الصالح والأخ الصالح‏.‏ فقلت من هذا قال هذا إدريس‏.‏ ثم مررت بموسى فقال مرحبا بالنبي الصالح والأخ الصالح‏.‏ قلت من هذا قال هذا موسى‏.‏ ثم مررت بعيسى فقال مرحبا بالأخ الصالح والنبي الصالح‏.‏ قلت من هذا قال هذا عيسى‏.‏ ثم مررت بإبراهيم فقال مرحبا بالنبي الصالح والابن الصالح‏.‏ قلت من هذا قال هذا إبراهيم صلى الله عليه وسلم ‏""‏‏.‏ قال ابن شهاب فأخبرني ابن حزم أن ابن عباس وأبا حبة الأنصاري كانا يقولان قال النبي صلى الله عليه وسلم ‏""‏ ثم عرج بي حتى ظهرت لمستوى أسمع فيه صريف الأقلام ‏""‏‏.‏ قال ابن حزم وأنس بن مالك قال النبي صلى الله عليه وسلم ‏""‏ ففرض الله على أمتي خمسين صلاة، فرجعت بذلك حتى مررت على موسى فقال ما فرض الله لك على أمتك قلت فرض خمسين صلاة‏.‏ قال فارجع إلى ربك، فإن أمتك لا تطيق ذلك‏.‏ فراجعت فوضع شطرها، فرجعت إلى موسى قلت وضع شطرها‏.‏ فقال راجع ربك، فإن أمتك لا تطيق، فراجعت فوضع شطرها، فرجعت إليه فقال ارجع إلى ربك، فإن أمتك لا تطيق ذلك، فراجعته‏.‏ فقال هي خمس وهى خمسون، لا يبدل القول لدى‏.‏ فرجعت إلى موسى فقال راجع ربك‏.‏ فقلت استحييت من ربي‏.‏ ثم انطلق بي حتى انتهى بي إلى سدرة المنتهى، وغشيها ألوان لا أدري ما هي، ثم أدخلت الجنة، فإذا فيها حبايل اللؤلؤ، وإذا ترابها المسك ‏""‏‏.‏"," Narrated Abu Dhar:                     Allah's Apostle said, ""While I was at Mecca the roof of my house was opened and Gabriel descended, opened my chest, and washed it with Zamzam water. Then he brought a golden tray full of wisdom and faith and having poured its contents into my chest, he closed it. Then he took my hand and ascended with me to the nearest heaven, when I reached the nearest heaven, Gabriel said to the gatekeeper of the heaven, 'Open (the gate).' The gatekeeper asked, 'Who is it?' Gabriel answered: 'Gabriel.' He asked, 'Is there anyone with you?' Gabriel replied, 'Yes, Muhammad I is with me.' He asked, 'Has he been called?' Gabriel said, 'Yes.' So the gate was opened and we went over the nearest heaven and there we saw a man sitting with some people on his right and some on his left. When he looked towards his right, he laughed and when he looked toward his left he wept. Then he said, 'Welcome! O pious Prophet and pious son.' I asked Gabriel, 'Who is he?' He replied, 'He is Adam and the people on his right and left are the souls of his offspring. Those on his right are the people of Paradise and those on his left are the people of Hell and when he looks towards his right he laughs and when he looks towards his left he weeps.' Then he ascended with me till he reached the second heaven and he (Gabriel) said to its gatekeeper, 'Open (the gate).' The gatekeeper said to him the same as the gatekeeper of the first heaven had said and he opened the gate. Anas said: ""Abu Dhar added that the Prophet met Adam, Idris, Moses, Jesus and Abraham, he (Abu Dhar) did not mention on which heaven they were but he mentioned that he (the Prophet ) met Adam on the nearest heaven and Abraham on the sixth heaven. Anas said, ""When Gabriel along with the Prophet passed by Idris, the latter said, 'Welcome! O pious Prophet and pious brother.' The Prophet asked, 'Who is he?' Gabriel replied, 'He is Idris."" The Prophet added, ""I passed by Moses and he said, 'Welcome! O pious Prophet and pious brother.' I asked Gabriel, 'Who is he?' Gabriel replied, 'He is Moses.' Then I passed by Jesus and he said, 'Welcome! O pious brother and pious Prophet.' I asked, 'Who is he?' Gabriel replied, 'He is Jesus. Then I passed by Abraham and he said, 'Welcome! O pious Prophet and pious son.' I asked Gabriel, 'Who is he?' Gabriel replied, 'He is Abraham. The Prophet added, 'Then Gabriel ascended with me to a place where I heard the creaking of the pens."" Ibn Hazm and Anas bin Malik said: The Prophet said, ""Then Allah enjoined fifty prayers on my followers when I returned with this order of Allah, I passed by Moses who asked me, 'What has Allah enjoined on your followers?' I replied, 'He has enjoined fifty prayers on them.' Moses said, 'Go back to your Lord (and appeal for reduction) for your followers will not be able to bear it.' (So I went back to Allah and requested for reduction) and He reduced it to half. When I passed by Moses again and informed him about it, he said, 'Go back to your Lord as your followers will not be able to bear it.' So I returned to Allah and requested for further reduction and half of it was reduced. I again passed by Moses and he said to me: 'Return to your Lord, for your followers will not be able to bear it. So I returned to Allah and He said, 'These are five prayers and they are all (equal to) fifty (in reward) for My Word does not change.' I returned to Moses and he told me to go back once again. I replied, 'Now I feel shy of asking my Lord again.' Then Gabriel took me till we '' reached Sidrat-il-Muntaha (Lote tree of; the utmost boundary) which was shrouded in colors, indescribable. Then I was admitted into Paradise where I found small (tents or) walls (made) of pearls and its earth was of musk."""
Prayers (Salat) - كتاب الصلاة,"30355, 20001, 11176, 10511, 53","حدثنا عبد الله بن يوسف، قال أخبرنا مالك، عن صالح بن كيسان، عن عروة بن الزبير، عن عائشة أم المؤمنين، قالت ‏""‏ فرض الله الصلاة حين فرضها ركعتين ركعتين في الحضر والسفر، فأقرت صلاة السفر، وزيد في صلاة الحضر ‏""‏‏.‏"," Narrated `Aisha:                     the mother of believers: Allah enjoined the prayer when He enjoined it, it was two rak`at only (in every prayer) both when in residence or on journey. Then the prayers offered on journey remained the same, but (the rak`at of) the prayers for non-travelers were increased."
Prayers (Salat) - كتاب الصلاة,"20040, 20303, 20278, 71","حدثنا موسى بن إسماعيل، قال حدثنا يزيد بن إبراهيم، عن محمد، عن أم عطية، قالت أمرنا أن نخرج، الحيض يوم العيدين وذوات الخدور، فيشهدن جماعة المسلمين ودعوتهم، ويعتزل الحيض عن مصلاهن‏.‏ قالت امرأة يا رسول الله، إحدانا ليس لها جلباب‏.‏ قال ‏""‏ لتلبسها صاحبتها من جلبابها ‏""‏‏.‏ وقال عبد الله بن رجاء حدثنا عمران، حدثنا محمد بن سيرين، حدثتنا أم عطية، سمعت النبي صلى الله عليه وسلم بهذا‏.‏"," Narrated Um `Atiya:                     We were ordered to bring out our menstruating women and veiled women in the religious gatherings and invocation of Muslims on the two `Id festivals. These menstruating women were to keep away from their Musalla. A woman asked, ""O Allah's Apostle ' What about one who does not have a veil?"" He said, ""Let her share the veil of her companion."""
Prayers (Salat) - كتاب الصلاة,"30184, 20163, 11544, 11048",حدثنا أحمد بن يونس، قال حدثنا عاصم بن محمد، قال حدثني واقد بن محمد، عن محمد بن المنكدر، قال صلى جابر في إزار قد عقده من قبل قفاه، وثيابه موضوعة على المشجب قال له قائل تصلي في إزار واحد فقال إنما صنعت ذلك ليراني أحمق مثلك، وأينا كان له ثوبان على عهد النبي صلى الله عليه وسلم," Narrated Muhammad bin Al-Munkadir:                     Once Jabir prayed with his Izar tied to his back while his clothes were Lying beside him on a wooden peg. Somebody asked him, ""Do you offer your prayer in a single Izar?"" He replied, ""I did so to show it to a fool like you. Had anyone of us two garments in the lifetime of the Prophet?"""
Prayers (Salat) - كتاب الصلاة,"30111, 20441, 11048",حدثنا مطرف أبو مصعب، قال حدثنا عبد الرحمن بن أبي الموالي، عن محمد بن المنكدر، قال رأيت جابر بن عبد الله يصلي في ثوب واحد وقال رأيت النبي صلى الله عليه وسلم يصلي في ثوب‏.‏, Narrated Muhammad bin Al Munkadir:                     I saw Jabir bin `Abdullah praying in a single garment and he said that he had seen the Prophet praying in a single garment.
Prayers (Salat) - كتاب الصلاة,"20340, 11065, 10511, 246",حدثنا عبيد الله بن موسى، قال حدثنا هشام بن عروة، عن أبيه، عن عمر بن أبي سلمة، أن النبي صلى الله عليه وسلم صلى في ثوب واحد قد خالف بين طرفيه‏.‏, Narrated `Umar bin Abi Salama:                     The Prophet prayed in one garment and crossed its ends.
Prayers (Salat) - كتاب الصلاة,"30170, 20031, 11065, 10511, 246",حدثنا محمد بن المثنى، قال حدثنا يحيى، قال حدثنا هشام، قال حدثني أبي، عن عمر بن أبي سلمة، أنه رأى النبي صلى الله عليه وسلم يصلي في ثوب واحد في بيت أم سلمة، قد ألقى طرفيه على عاتقيه‏.‏, Narrated `Umar bin Abi Salama:                     I saw the Prophet offering prayers in a single garment in the house of Um-Salama and he had crossed its ends around his shoulders.
Prayers (Salat) - كتاب الصلاة,"30360, 20318, 11065, 10511, 246",حدثنا عبيد بن إسماعيل، قال حدثنا أبو أسامة، عن هشام، عن أبيه، أن عمر بن أبي سلمة، أخبره قال رأيت رسول الله صلى الله عليه وسلم يصلي في ثوب واحد مشتملا به في بيت أم سلمة، واضعا طرفيه على عاتقيه‏.‏," Narrated `Umar bin Abi Salama:                     In the house of Um-Salama I saw Allah's Apostle offering prayers, wrapped in a single garment around his body with its ends crossed round his shoulders."
Prayers (Salat) - كتاب الصلاة,"30103, 20001, 11164, 11237","حدثنا إسماعيل بن أبي أويس، قال حدثني مالك بن أنس، عن أبي النضر، مولى عمر بن عبيد الله أن أبا مرة، مولى أم هانئ بنت أبي طالب أخبره أنه، سمع أم هانئ بنت أبي طالب، تقول ذهبت إلى رسول الله صلى الله عليه وسلم عام الفتح، فوجدته يغتسل، وفاطمة ابنته تستره قالت فسلمت عليه فقال ‏""‏ من هذه ‏""‏‏.‏ فقلت أنا أم هانئ بنت أبي طالب‏.‏ فقال ‏""‏ مرحبا بأم هانئ ‏""‏‏.‏ فلما فرغ من غسله، قام فصلى ثماني ركعات، ملتحفا في ثوب واحد، فلما انصرف قلت يا رسول الله، زعم ابن أمي أنه قاتل رجلا قد أجرته فلان بن هبيرة‏.‏ فقال رسول الله صلى الله عليه وسلم ‏""‏ قد أجرنا من أجرت يا أم هانئ ‏""‏‏.‏ قالت أم هانئ وذاك ضحى‏.‏"," Narrated Abu Murra:                     (the freed slave of Um Hani) Um Hani, the daughter of Abi Talib said, ""I went to Allah's Apostle in the year of the conquest of Mecca and found him taking a bath and his daughter Fatima was screening him. I greeted him. He asked, 'Who is she?' I replied, 'I am Um Hani bint Abi Talib.' He said, 'Welcome! O Um Hani.' When he finished his bath he stood up and prayed eight rak`at while wearing a single garment wrapped round his body and when he finished I said, 'O Allah's Apostle ! My brother has told me that he will kill a person whom I gave shelter and that person is so and so the son of Hubaira.' The Prophet said, 'We shelter the person whom you have sheltered.' "" Um Ham added, ""And that was before noon (Duha)."
Prayers (Salat) - كتاب الصلاة,"30355, 20001, 11013, 11002, 13","حدثنا عبد الله بن يوسف، قال أخبرنا مالك، عن ابن شهاب، عن سعيد بن المسيب، عن أبي هريرة، أن سائلا، سأل رسول الله صلى الله عليه وسلم عن الصلاة في ثوب واحد فقال رسول الله صلى الله عليه وسلم ‏""‏ أولكلكم ثوبان ‏""‏‏.‏"," Narrated Abu Huraira:                     A person asked Allah's Apostle about the offering of the prayer in a single garment. Allah's Apostle replied, ""Has every one of you got two garments?"""
Prayers (Salat) - كتاب الصلاة,"20241, 20001, 11061, 11197, 13","حدثنا أبو عاصم، عن مالك، عن أبي الزناد، عن عبد الرحمن الأعرج، عن أبي هريرة، قال قال النبي صلى الله عليه وسلم ‏""‏ لا يصلي أحدكم في الثوب الواحد، ليس على عاتقيه شىء ‏""‏‏.‏"," Narrated Abu Huraira:                     The Prophet said, ""None of you should offer prayer in a single garment that does not cover the shoulders."""
Prayers (Salat) - كتاب الصلاة,"20348, 20240, 11449, 11023, 13","حدثنا أبو نعيم، قال حدثنا شيبان، عن يحيى بن أبي كثير، عن عكرمة، قال سمعته  أو، كنت سألته  قال سمعت أبا هريرة، يقول أشهد أني سمعت رسول الله صلى الله عليه وسلم يقول ‏""‏ من صلى في ثوب واحد، فليخالف بين طرفيه ‏""‏‏.‏"," Narrated Abu Huraira:                     Allah's Apostle said, ""Whoever prays in a single garment must cross its ends (over the shoulders)."
Prayers (Salat) - كتاب الصلاة,"20470, 20169, 11167, 34","حدثنا يحيى بن صالح، قال حدثنا فليح بن سليمان، عن سعيد بن الحارث، قال سألنا جابر بن عبد الله عن الصلاة، في الثوب الواحد فقال خرجت مع النبي صلى الله عليه وسلم في بعض أسفاره، فجئت ليلة لبعض أمري، فوجدته يصلي وعلى ثوب واحد، فاشتملت به وصليت إلى جانبه، فلما انصرف قال ‏""‏ ما السرى يا جابر ‏""‏‏.‏ فأخبرته بحاجتي، فلما فرغت قال ‏""‏ ما هذا الاشتمال الذي رأيت ‏""‏‏.‏ قلت كان ثوب‏.‏ يعني ضاق‏.‏ قال ‏""‏ فإن كان واسعا فالتحف به، وإن كان ضيقا فاتزر به ‏""‏‏.‏"," Narrated Sa`id bin Al-Harith:                     I asked Jabir bin `Abdullah about praying in a single garment. He said, ""I traveled with the Prophet during some of his journeys, and I came to him at night for some purpose and I found him praying. At that time, I was wearing a single garment with which I covered my shoulders and prayed by his side. When he finished the prayer, he asked, 'O Jabir! What has brought you here?' I told him what I wanted. When I finished, he asked, 'O Jabir! What is this garment which I have seen and with which you covered your shoulders?' I replied, 'It is a (tight) garment.' He said, 'If the garment is large enough, wrap it round the body (covering the shoulders) and if it is tight (too short) then use it as an Izar (tie it around your waist only.)' """
Prayers (Salat) - كتاب الصلاة,"30175, 20031, 20012, 11172, 399",حدثنا مسدد، قال حدثنا يحيى، عن سفيان، قال حدثني أبو حازم، عن سهل، قال كان رجال يصلون مع النبي صلى الله عليه وسلم عاقدي أزرهم على أعناقهم كهيئة الصبيان، وقال للنساء لا ترفعن رءوسكن حتى يستوي الرجال جلوسا‏.‏, Narrated Sahl:                     The men used to pray with the Prophet with their Izars tied around their necks as boys used to do; therefore the Prophet told the women not to raise their heads till the men sat down straight (while praying).
