chapter,chain_indx,text_ar,text_en
Knowledge - كتاب العلم,"30330, 20428, 11013, 30184, 20029, 20475, 11013, 11200, 17, 3","حدثنا أبو اليمان، أخبرنا شعيب، عن الزهري، ح قال أبو عبد الله وقال ابن وهب أخبرنا يونس، عن ابن شهاب، عن عبيد الله بن عبد الله بن أبي ثور، عن عبد الله بن عباس، عن عمر، قال كنت أنا وجار، لي من الأنصار في بني أمية بن زيد، وهى من عوالي المدينة، وكنا نتناوب النزول على رسول الله صلى الله عليه وسلم ينزل يوما وأنزل يوما، فإذا نزلت جئته بخبر ذلك اليوم من الوحى وغيره، وإذا نزل فعل مثل ذلك، فنزل صاحبي الأنصاري يوم نوبته، فضرب بابي ضربا شديدا‏.‏ فقال أثم هو ففزعت فخرجت إليه فقال قد حدث أمر عظيم‏.‏ قال فدخلت على حفصة فإذا هي تبكي فقلت طلقكن رسول الله صلى الله عليه وسلم قالت لا أدري‏.‏ ثم دخلت على النبي صلى الله عليه وسلم فقلت وأنا قائم أطلقت نساءك قال ‏""‏ لا ‏""‏‏.‏ فقلت الله أكبر‏.‏"," Narrated `Umar:                     My Ansari neighbor from Bani Umaiya bin Zaid who used to live at `Awali Al-Medina and used to visit the Prophet by turns. He used to go one day and I another day. When I went I used to bring the news of that day regarding the Divine Inspiration and other things, and when he went, he used to do the same for me. Once my Ansari friend, in his turn (on returning from the Prophet), knocked violently at my door and asked if I was there."" I became horrified and came out to him. He said, ""Today a great thing has happened."" I then went to Hafsa and saw her weeping. I asked her, ""Did Allah's Apostle divorce you all?"" She replied, ""I do not know."" Then, I entered upon the Prophet and said while standing, ""Have you divorced your wives?"" The Prophet replied in the negative. On what I said, ""Allahu-Akbar (Allah is Greater)."" (See Hadith No. 119, Vol. 3 for details)"
Knowledge - كتاب العلم,"28531, 20012, 11418, 11046, 402","حدثنا محمد بن كثير، قال أخبرنا سفيان، عن ابن أبي خالد، عن قيس بن أبي حازم، عن أبي مسعود الأنصاري، قال قال رجل يا رسول الله، لا أكاد أدرك الصلاة مما يطول بنا فلان، فما رأيت النبي صلى الله عليه وسلم في موعظة أشد غضبا من يومئذ فقال ‏""‏ أيها الناس، إنكم منفرون، فمن صلى بالناس فليخفف، فإن فيهم المريض والضعيف وذا الحاجة ‏""‏‏.‏"," Narrated Abu Mas`ud Al-Ansari:                     Once a man said to Allah's Apostle ""O Allah's Apostle! I may not attend the (compulsory congregational) prayer because so and so (the Imam) prolongs the prayer when he leads us for it. The narrator added: ""I never saw the Prophet more furious in giving advice than he was on that day. The Prophet said, ""O people! Some of you make others dislike good deeds (the prayers). So whoever leads the people in prayer should shorten it because among them there are the sick the weak and the needy (having some jobs to do)."
Knowledge - كتاب العلم,"30351, 20443, 20160, 11162, 11238, 3625","حدثنا عبد الله بن محمد، قال حدثنا أبو عامر، قال حدثنا سليمان بن بلال المديني، عن ربيعة بن أبي عبد الرحمن، عن يزيد، مولى المنبعث عن زيد بن خالد الجهني، أن النبي صلى الله عليه وسلم سأله رجل عن اللقطة فقال ‏""‏ اعرف وكاءها  أو قال وعاءها  وعفاصها، ثم عرفها سنة، ثم استمتع بها، فإن جاء ربها فأدها إليه ‏""‏‏.‏ قال فضالة الإبل فغضب حتى احمرت وجنتاه  أو قال احمر وجهه  فقال ‏""‏ وما لك ولها معها سقاؤها وحذاؤها، ترد الماء، وترعى الشجر، فذرها حتى يلقاها ربها ‏""‏‏.‏ قال فضالة الغنم قال ‏""‏ لك أو لأخيك أو للذئب ‏""‏‏.‏"," Narrated Zaid bin Khalid Al-Juhani:                     A man asked the Prophet about the picking up of a ""Luqata"" (fallen lost thing). The Prophet replied, ""Recognize and remember its tying material and its container, and make public announcement (about it) for one year, then utilize it but give it to its owner if he comes."" Then the person asked about the lost camel. On that, the Prophet got angry and his cheeks or his Face became red and he said, ""You have no concern with it as it has its water container, and its feet and it will reach water, and eat (the leaves) of trees till its owner finds it."" The man then asked about the lost sheep. The Prophet replied, ""It is either for you, for your brother (another person) or for the wolf."""
Knowledge - كتاب العلم,"30216, 20318, 11325, 11901, 41","حدثنا محمد بن العلاء، قال حدثنا أبو أسامة، عن بريد، عن أبي بردة، عن أبي موسى، قال سئل النبي صلى الله عليه وسلم عن أشياء كرهها، فلما أكثر عليه غضب، ثم قال للناس ‏""‏ سلوني عما شئتم ‏""‏‏.‏ قال رجل من أبي قال ‏""‏ أبوك حذافة ‏""‏‏.‏ فقام آخر فقال من أبي يا رسول الله فقال ‏""‏ أبوك سالم مولى شيبة ‏""‏‏.‏ فلما رأى عمر ما في وجهه قال يا رسول الله، إنا نتوب إلى الله عز وجل‏.‏"," Narrated Abu Musa:                     The Prophet was asked about things which he did not like, but when the questioners insisted, the Prophet got angry. He then said to the people, ""Ask me anything you like."" A man asked, ""Who is my father?"" The Prophet replied, ""Your father is Hudhafa."" Then another man got up and said, ""Who is my father, O Allah's Apostle ?"" He replied, ""Your father is Salim, Maula (the freed slave) of Shaiba."" So when `Umar saw that (the anger) on the face of the Prophet he said, ""O Allah's Apostle! We repent to Allah (Our offending you)."
Knowledge - كتاب العلم,"30330, 20428, 11013, 19","حدثنا أبو اليمان، قال أخبرنا شعيب، عن الزهري، قال أخبرني أنس بن مالك، أن رسول الله صلى الله عليه وسلم خرج، فقام عبد الله بن حذافة فقال من أبي فقال ‏""‏ أبوك حذافة ‏""‏‏.‏ ثم أكثر أن يقول ‏""‏ سلوني ‏""‏‏.‏ فبرك عمر على ركبتيه فقال رضينا بالله ربا، وبالإسلام دينا، وبمحمد صلى الله عليه وسلم نبيا، فسكت‏.‏"," Narrated Anas bin Malik:                     One day Allah's Apostle came out (before the people) and `Abdullah bin Hudhafa stood up and asked (him) ""Who is my father?"" The Prophet replied, ""Your father is Hudhafa."" The Prophet told them repeatedly (in anger) to ask him anything they liked. `Umar knelt down before the Prophet and said thrice, ""We accept Allah as (our) Lord and Islam as (our) religion and Muhammad as (our) Prophet."" After that the Prophet became silent."
Knowledge - كتاب العلم,"20337, 20250, 11599, 11270, 19",حدثنا عبدة، قال حدثنا عبد الصمد، قال حدثنا عبد الله بن المثنى، قال حدثنا ثمامة بن عبد الله، عن أنس، عن النبي صلى الله عليه وسلم أنه كان إذا سلم سلم ثلاثا، وإذا تكلم بكلمة أعادها ثلاثا‏.‏," Narrated Anas:                     Whenever the Prophet asked permission to enter, he knocked the door thrice with greeting and whenever he spoke a sentence (said a thing) he used to repeat it thrice. (See Hadith No. 261, Vol. 8)."
Knowledge - كتاب العلم,"30149, 20250, 11599, 11270, 19",حدثنا عبدة بن عبد الله، حدثنا عبد الصمد، قال حدثنا عبد الله بن المثنى، قال حدثنا ثمامة بن عبد الله، عن أنس، عن النبي صلى الله عليه وسلم أنه كان إذا تكلم بكلمة أعادها ثلاثا حتى تفهم عنه، وإذا أتى على قوم فسلم عليهم سلم عليهم ثلاثا‏.‏," Narrated Anas:                     Whenever the Prophet spoke a sentence (said a thing), he used to repeat it thrice so that the people could understand it properly from him and whenever he asked permission to enter, (he knocked the door) thrice with greeting."
Knowledge - كتاب العلم,"30175, 20469, 11419, 11264, 29","حدثنا مسدد، قال حدثنا أبو عوانة، عن أبي بشر، عن يوسف بن ماهك، عن عبد الله بن عمرو، قال تخلف رسول الله صلى الله عليه وسلم في سفر سافرناه فأدركنا وقد أرهقنا الصلاة صلاة العصر ونحن نتوضأ، فجعلنا نمسح على أرجلنا، فنادى بأعلى صوته ‏""‏ ويل للأعقاب من النار ‏""‏‏.‏ مرتين أو ثلاثا‏.‏"," Narrated `Abdullah bin `Amr:                     Once Allah's Apostle remained behind us in a journey. He joined us while we were performing ablution for the `Asr prayer which was over-due. We were just passing wet hands over our feet (not washing them properly) so the Prophet addressed us in a loud voice and said twice or thrice, ""Save your heels from the fire."""
Knowledge - كتاب العلم,"30376, 20333, 15239, 11052, 11901, 41","أخبرنا محمد  هو ابن سلام  حدثنا المحاربي، قال حدثنا صالح بن حيان، قال قال عامر الشعبي حدثني أبو بردة، عن أبيه، قال قال رسول الله صلى الله عليه وسلم ‏""‏ ثلاثة لهم أجران رجل من أهل الكتاب آمن بنبيه، وآمن بمحمد صلى الله عليه وسلم والعبد المملوك إذا أدى حق الله وحق مواليه، ورجل كانت عنده أمة ‏{‏يطؤها‏}‏ فأدبها، فأحسن تأديبها، وعلمها فأحسن تعليمها، ثم أعتقها فتزوجها، فله أجران ‏""‏‏.‏ثم قال عامر أعطيناكها بغير شىء، قد كان يركب فيما دونها إلى المدينة‏.‏","      Narrated Abu Burda's father:                          Allah's Apostle said ""Three persons will have a double reward:     1. A Person from the people of the scriptures who believed in his      prophet (Jesus or Moses) and then believed in the Prophet Muhammad (i      .e. has embraced Islam).     2. A slave who discharges his duties to Allah and his master.     3. A master of a woman-slave who teaches her good manners and educates     her in the best possible way (the religion) and manumits her and then      marries her."""
Knowledge - كتاب العلم,"20193, 20020, 11015, 11029, 17",حدثنا سليمان بن حرب، قال حدثنا شعبة، عن أيوب، قال سمعت عطاء، قال سمعت ابن عباس، قال أشهد على النبي صلى الله عليه وسلم  أو قال عطاء أشهد على ابن عباس  أن رسول الله صلى الله عليه وسلم خرج ومعه بلال، فظن أنه لم يسمع النساء فوعظهن، وأمرهن بالصدقة، فجعلت المرأة تلقي القرط والخاتم، وبلال يأخذ في طرف ثوبه‏.‏وقال إسماعيل عن أيوب عن عطاء وقال عن ابن عباس أشهد على النبي صلى الله عليه وسلم‏.‏,"      Narrated Ibn 'Abbas:                          Once Allah's Apostle came out while Bilal was accompanying him. He      went towards the women thinking that they had not heard him (i.e. his      sermon). So he preached them and ordered them to pay alms. (Hearing      that) the women started giving alms; some donated their ear-rings,      some gave their rings and Bilal was collecting them in the corner of      his garment."
Knowledge - كتاب العلم,"30105, 20160, 11209, 11168, 13","حدثنا عبد العزيز بن عبد الله، قال حدثني سليمان، عن عمرو بن أبي عمرو، عن سعيد بن أبي سعيد المقبري، عن أبي هريرة، أنه قال قيل يا رسول الله، من أسعد الناس بشفاعتك يوم القيامة قال رسول الله صلى الله عليه وسلم ‏""‏ لقد ظننت يا أبا هريرة أن لا يسألني عن هذا الحديث أحد أول منك، لما رأيت من حرصك على الحديث، أسعد الناس بشفاعتي يوم القيامة من قال لا إله إلا الله، خالصا من قلبه أو نفسه ‏""‏‏.‏"," Narrated Abu Huraira:                     I said: ""O Allah's Apostle! Who will be the luckiest person, who will gain your intercession on the Day of Resurrection?"" Allah's Apostle said: O Abu Huraira! ""I have thought that none will ask me about it before you as I know your longing for the (learning of) Hadiths. The luckiest person who will have my intercession on the Day of Resurrection will be the one who said sincerely from the bottom of his heart ""None has the right to be worshipped but Allah."""
Knowledge - كتاب العلم,"30103, 20001, 11065, 10511, 29","حدثنا إسماعيل بن أبي أويس، قال حدثني مالك، عن هشام بن عروة، عن أبيه، عن عبد الله بن عمرو بن العاص، قال سمعت رسول الله صلى الله عليه وسلم يقول ‏""‏ إن الله لا يقبض العلم انتزاعا، ينتزعه من العباد، ولكن يقبض العلم بقبض العلماء، حتى إذا لم يبق عالما، اتخذ الناس رءوسا جهالا فسئلوا، فأفتوا بغير علم، فضلوا وأضلوا ‏""‏‏.قال الفربري حدثنا عباس قال حدثنا قتيبة حدثنا جرير عن هشام نحوه‏.‏"," Narrated `Abdullah bin `Amr bin Al-`As:                     I heard Allah's Apostle saying, ""Allah does not take away the knowledge, by taking it away from (the hearts of) the people, but takes it away by the death of the religious learned men till when none of the (religious learned men) remains, people will take as their leaders ignorant persons who when consulted will give their verdict without knowledge. So they will go astray and will lead the people astray."""
Knowledge - كتاب العلم,"20404, 20020, 11364, 11161","حدثنا آدم، قال حدثنا شعبة، قال حدثني ابن الأصبهاني، قال سمعت أبا صالح، ذكوان يحدث عن أبي سعيد الخدري،‏.‏ قالت النساء للنبي صلى الله عليه وسلم غلبنا عليك الرجال، فاجعل لنا يوما من نفسك‏.‏ فوعدهن يوما لقيهن فيه، فوعظهن وأمرهن، فكان فيما قال لهن ‏""‏ ما منكن امرأة تقدم ثلاثة من ولدها إلا كان لها حجابا من النار ‏""‏‏.‏ فقالت امرأة واثنين فقال ‏""‏ واثنين ‏""‏‏.‏"," Narrated Abu Sa`id Al-Khudri:                     Some women requested the Prophet to fix a day for them as the men were taking all his time. On that he promised them one day for religious lessons and commandments. Once during such a lesson the Prophet said, ""A woman whose three children die will be shielded by them from the Hell fire."" On that a woman asked, ""If only two die?"" He replied, ""Even two (will shield her from the Hell-fire)."
Knowledge - كتاب العلم,"30160, 20278, 20020, 11364, 11161, 38","حدثنا محمد بن بشار، قال حدثنا غندر، قال حدثنا شعبة، عن عبد الرحمن بن الأصبهاني، عن ذكوان، عن أبي سعيد الخدري، عن النبي صلى الله عليه وسلم بهذا‏.‏ وعن عبد الرحمن بن الأصبهاني، قال سمعت أبا حازم، عن أبي هريرة، قال ‏""‏ ثلاثة لم يبلغوا الحنث ‏""‏‏.‏", Narrated Abu Sa`id Al-Khudri:                     as above (the sub narrators are different). Abu Huraira qualified the three children referred to in the above mentioned Hadith as not having reached the age of committing sins (i.e. age of puberty) .
Knowledge - كتاب العلم,"30232, 20203, 11090, 53","حدثنا سعيد بن أبي مريم، قال أخبرنا نافع بن عمر، قال حدثني ابن أبي مليكة، أن عائشة، زوج النبي صلى الله عليه وسلم كانت لا تسمع شيئا لا تعرفه إلا راجعت فيه حتى تعرفه، وأن النبي صلى الله عليه وسلم قال ‏""‏ من حوسب عذب ‏""‏‏.‏ قالت عائشة فقلت أو ليس يقول الله تعالى ‏{‏فسوف يحاسب حسابا يسيرا‏}‏ قالت فقال ‏""‏ إنما ذلك العرض، ولكن من نوقش الحساب يهلك ‏""‏‏.‏"," Narrated Ibn Abu Mulaika:                     Whenever `Aisha (the wife of the Prophet) heard anything which she did not understand, she used to ask again till she understood it completely. Aisha said: ""Once the Prophet said, ""Whoever will be called to account (about his deeds on the Day of Resurrection) will surely be punished."" I said, ""Doesn't Allah say: ""He surely will receive an easy reckoning."" (84.8) The Prophet replied, ""This means only the presentation of the accounts but whoever will be argued about his account, will certainly be ruined."""
Knowledge - كتاب العلم,"30355, 20023, 11168, 5355","حدثنا عبد الله بن يوسف، قال حدثني الليث، قال حدثني سعيد، عن أبي شريح، أنه قال لعمرو بن سعيد وهو يبعث البعوث إلى مكة ائذن لي أيها الأمير أحدثك قولا قام به النبي صلى الله عليه وسلم الغد من يوم الفتح، سمعته أذناى ووعاه قلبي، وأبصرته عيناى، حين تكلم به، حمد الله وأثنى عليه ثم قال ‏""‏ إن مكة حرمها الله، ولم يحرمها الناس، فلا يحل لامرئ يؤمن بالله واليوم الآخر أن يسفك بها دما، ولا يعضد بها شجرة، فإن أحد ترخص لقتال رسول الله صلى الله عليه وسلم فيها فقولوا إن الله قد أذن لرسوله، ولم يأذن لكم‏.‏ وإنما أذن لي فيها ساعة من نهار، ثم عادت حرمتها اليوم كحرمتها بالأمس، وليبلغ الشاهد الغائب ‏""‏‏.‏ فقيل لأبي شريح ما قال عمرو قال أنا أعلم منك يا أبا شريح، لا يعيذ عاصيا، ولا فارا بدم، ولا فارا بخربة‏.‏"," Narrated Sa`id:                     Abu Shuraih said, ""When `Amr bin Sa`id was sending the troops to Mecca (to fight `Abdullah bin Az- Zubair) I said to him, 'O chief! Allow me to tell you what the Prophet said on the day following the conquests of Mecca. My ears heard and my heart comprehended, and I saw him with my own eyes, when he said it. He glorified and praised Allah and then said, ""Allah and not the people has made Mecca a sanctuary. So anybody who has belief in Allah and the Last Day (i.e. a Muslim) should neither shed blood in it nor cut down its trees. If anybody argues that fighting is allowed in Mecca as Allah's Apostle did fight (in Mecca), tell him that Allah gave permission to His Apostle, but He did not give it to you. The Prophet added: Allah allowed me only for a few hours on that day (of the conquest) and today (now) its sanctity is the same (valid) as it was before. So it is incumbent upon those who are present to convey it (this information) to those who are absent."" Abu- Shuraih was asked, ""What did `Amr reply?"" He said `Amr said, ""O Abu Shuraih! I know better than you (in this respect). Mecca does not give protection to one who disobeys (Allah) or runs after committing murder, or theft (and takes refuge in Mecca)."
Knowledge - كتاب العلم,"30143, 20022, 11015, 11035, 11294, 3229","حدثنا عبد الله بن عبد الوهاب، قال حدثنا حماد، عن أيوب، عن محمد، عن ابن أبي بكرة، عن أبي بكرة، ذكر النبي صلى الله عليه وسلم قال ‏""‏ فإن دماءكم وأموالكم  قال محمد وأحسبه قال وأعراضكم  عليكم حرام كحرمة يومكم هذا في شهركم هذا، ألا ليبلغ الشاهد منكم الغائب ‏""‏‏.‏ وكان محمد يقول صدق رسول الله صلى الله عليه وسلم كان ذلك ‏""‏ ألا هل بلغت ‏""‏ مرتين‏.‏"," Narrated Abu Bakra:                     The Prophet said. No doubt your blood, property, the sub-narrator Muhammad thought that Abu Bakra had also mentioned and your honor (chastity), are sacred to one another as is the sanctity of this day of yours in this month of yours. It is incumbent on those who are present to inform those who are absent."" (Muhammad the Sub-narrator used to say, ""Allah's Apostle told the truth."") The Prophet repeated twice: ""No doubt! Haven't I conveyed Allah's message to you."
Knowledge - كتاب العلم,"20386, 20020, 11067, 11334, 5","حدثنا علي بن الجعد، قال أخبرنا شعبة، قال أخبرني منصور، قال سمعت ربعي بن حراش، يقول سمعت عليا، يقول قال النبي صلى الله عليه وسلم ‏""‏ لا تكذبوا على، فإنه من كذب على فليلج النار ‏""‏‏.‏"," Narrated `Ali:                     The Prophet said, ""Do not tell a lie against me for whoever tells a lie against me (intentionally) then he will surely enter the Hell-fire."""
Knowledge - كتاب العلم,"20296, 20020, 11328, 11178, 106","حدثنا أبو الوليد، قال حدثنا شعبة، عن جامع بن شداد، عن عامر بن عبد الله بن الزبير، عن أبيه، قال قلت للزبير إني لا أسمعك تحدث عن رسول الله صلى الله عليه وسلم كما يحدث فلان وفلان‏.‏ قال أما إني لم أفارقه ولكن سمعته يقول ‏""‏ من كذب على فليتبوأ مقعده من النار ‏""‏‏.‏"," Narrated `Abdullah bin Az-Zubair:                     I said to my father, 'I do not hear from you any narration (Hadith) of Allah s Apostle as I hear (his narration) from so and so?"" Az-Zubair replied. l was always with him (the Prophet) and I heard him saying ""Whoever tells a lie against me (intentionally) then (surely) let him occupy, his seat in Hellfire."
Knowledge - كتاب العلم,"30315, 20258, 11295, 19","حدثنا أبو معمر، قال حدثنا عبد الوارث، عن عبد العزيز، قال أنس إنه ليمنعني أن أحدثكم حديثا كثيرا أن النبي صلى الله عليه وسلم قال ‏""‏ من تعمد على كذبا فليتبوأ مقعده من النار ‏""‏‏.‏"," Narrated Anas:                     The fact which stops me from narrating a great number of Hadiths to you is that the Prophet said: ""Whoever tells a lie against me intentionally, then (surely) let him occupy his seat in Hell-fire."""
Knowledge - كتاب العلم,"20202, 11450, 237","حدثنا مكي بن إبراهيم، قال حدثنا يزيد بن أبي عبيد، عن سلمة، قال سمعت النبي صلى الله عليه وسلم يقول ‏""‏ من يقل على ما لم أقل فليتبوأ مقعده من النار ‏""‏‏.‏"," Narrated Salama:                     I heard the Prophet saying, ""Whoever (intentionally) ascribes to me what I have not said then (surely) let him occupy his seat in Hell-fire."""
Knowledge - كتاب العلم,"20040, 20469, 11371, 11161, 13","حدثنا موسى، قال حدثنا أبو عوانة، عن أبي حصين، عن أبي صالح، عن أبي هريرة، عن النبي صلى الله عليه وسلم قال ‏""‏ تسموا باسمي ولا تكتنوا بكنيتي، ومن رآني في المنام فقد رآني، فإن الشيطان لا يتمثل في صورتي، ومن كذب على متعمدا فليتبوأ مقعده من النار ‏""‏‏.‏"," Narrated Abu Huraira:                     The Prophet said, ""Name yourselves with my name (use my name) but do not name yourselves with my Kunya name (i.e. Abul Qasim). And whoever sees me in a dream then surely he has seen me for Satan cannot impersonate me. And whoever tells a lie against me (intentionally), then (surely) let him occupy his seat in Hell-fire."""
