chapter,chain_indx,text_ar,text_en
Revelation - كتاب بدء الوحى,"30418, 20005, 11062, 11213, 11042, 3","حدثنا الحميدي عبد الله بن الزبير، قال حدثنا سفيان، قال حدثنا يحيى بن سعيد الأنصاري، قال أخبرني محمد بن إبراهيم التيمي، أنه سمع علقمة بن وقاص الليثي، يقول سمعت عمر بن الخطاب  رضى الله عنه  على المنبر قال سمعت رسول الله صلى الله عليه وسلم يقول ‏""‏ إنما الأعمال بالنيات، وإنما لكل امرئ ما نوى، فمن كانت هجرته إلى دنيا يصيبها أو إلى امرأة ينكحها فهجرته إلى ما هاجر إليه ‏""‏‏.‏","      Narrated 'Umar bin Al-Khattab:                          I heard Allah's Apostle saying, ""The reward of deeds depends upon the      intentions and every person will get the reward according to what he      has intended. So whoever emigrated for worldly benefits or for a woman     to marry, his emigration was for what he emigrated for."""
Revelation - كتاب بدء الوحى,"30355, 20001, 11065, 10511, 53","حدثنا عبد الله بن يوسف، قال أخبرنا مالك، عن هشام بن عروة، عن أبيه، عن عائشة أم المؤمنين  رضى الله عنها  أن الحارث بن هشام  رضى الله عنه  سأل رسول الله صلى الله عليه وسلم فقال يا رسول الله كيف يأتيك الوحى فقال رسول الله صلى الله عليه وسلم ‏""‏ أحيانا يأتيني مثل صلصلة الجرس  وهو أشده على  فيفصم عني وقد وعيت عنه ما قال، وأحيانا يتمثل لي الملك رجلا فيكلمني فأعي ما يقول ‏""‏‏.‏ قالت عائشة رضى الله عنها ولقد رأيته ينزل عليه الوحى في اليوم الشديد البرد، فيفصم عنه وإن جبينه ليتفصد عرقا‏.‏","      Narrated 'Aisha:                          (the mother of the faithful believers) Al-Harith bin Hisham asked Allah's Apostle ""O Allah's Apostle! How is the Divine Inspiration revealed to you?"" Allah's Apostle replied, ""Sometimes it is (revealed) like the ringing of a bell, this form of Inspiration is the hardest of all and then this state passes off after I have grasped what is inspired. Sometimes the Angel comes in the form of a man and talks to me and I grasp whatever he says."" 'Aisha added: Verily I saw the Prophet being inspired divinely on a very cold day and noticed the sweat dropping from his forehead (as the Inspiration was over)."
Revelation - كتاب بدء الوحى,"30399, 20023, 11207, 11013, 10511, 53","حدثنا يحيى بن بكير، قال حدثنا الليث، عن عقيل، عن ابن شهاب، عن عروة بن الزبير، عن عائشة أم المؤمنين، أنها قالت أول ما بدئ به رسول الله صلى الله عليه وسلم من الوحى الرؤيا الصالحة في النوم، فكان لا يرى رؤيا إلا جاءت مثل فلق الصبح، ثم حبب إليه الخلاء، وكان يخلو بغار حراء فيتحنث فيه  وهو التعبد  الليالي ذوات العدد قبل أن ينزع إلى أهله، ويتزود لذلك، ثم يرجع إلى خديجة، فيتزود لمثلها، حتى جاءه الحق وهو في غار حراء، فجاءه الملك فقال اقرأ‏.‏ قال ‏""‏ ما أنا بقارئ ‏""‏‏.‏ قال ‏""‏ فأخذني فغطني حتى بلغ مني الجهد، ثم أرسلني فقال اقرأ‏.‏ قلت ما أنا بقارئ‏.‏ فأخذني فغطني الثانية حتى بلغ مني الجهد، ثم أرسلني فقال اقرأ‏.‏ فقلت ما أنا بقارئ‏.‏ فأخذني فغطني الثالثة، ثم أرسلني فقال ‏{‏اقرأ باسم ربك الذي خلق * خلق الإنسان من علق * اقرأ وربك الأكرم‏}‏ ‏""‏‏.‏ فرجع بها رسول الله صلى الله عليه وسلم يرجف فؤاده، فدخل على خديجة بنت خويلد رضى الله عنها فقال ‏""‏ زملوني زملوني ‏""‏‏.‏ فزملوه حتى ذهب عنه الروع، فقال لخديجة وأخبرها الخبر ‏""‏ لقد خشيت على نفسي ‏""‏‏.‏ فقالت خديجة كلا والله ما يخزيك الله أبدا، إنك لتصل الرحم، وتحمل الكل، وتكسب المعدوم، وتقري الضيف، وتعين على نوائب الحق‏.‏ فانطلقت به خديجة حتى أتت به ورقة بن نوفل بن أسد بن عبد العزى ابن عم خديجة  وكان امرأ تنصر في الجاهلية، وكان يكتب الكتاب العبراني، فيكتب من الإنجيل بالعبرانية ما شاء الله أن يكتب، وكان شيخا كبيرا قد عمي  فقالت له خديجة يا ابن عم اسمع من ابن أخيك‏.‏ فقال له ورقة يا ابن أخي ماذا ترى فأخبره رسول الله صلى الله عليه وسلم خبر ما رأى‏.‏ فقال له ورقة هذا الناموس الذي نزل الله على موسى صلى الله عليه وسلم يا ليتني فيها جذعا، ليتني أكون حيا إذ يخرجك قومك‏.‏ فقال رسول الله صلى الله عليه وسلم ‏""‏ أومخرجي هم ‏""‏‏.‏ قال نعم، لم يأت رجل قط بمثل ما جئت به إلا عودي، وإن يدركني يومك أنصرك نصرا مؤزرا‏.‏ ثم لم ينشب ورقة أن توفي وفتر الوحى‏.‏"," Narrated 'Aisha:                       (the mother of the faithful believers) The commencement of the Divine Inspiration to Allah's Apostle was in the form of good dreams which came true like bright daylight, and then the love of seclusion was bestowed upon him. He used to go in seclusion in the cave of Hira where he used to worship (Allah alone) continuously for many days before his desire to see his family. He used to take with him the journey food for the stay and then come back to (his wife) Khadija to take his food likewise again till suddenly the Truth descended upon him while he was in the cave of Hira. The angel came to him and asked him to read. The Prophet replied, ""I do not know how to read."" The Prophet added, ""The angel caught me (forcefully) and pressed me so hard that I could not bear it any more. He then released me and again asked me to read and I replied, 'I do not know how to read.' Thereupon he caught me again and pressed me a second time till I could not bear it any more. He then released me and again asked me to read but again I replied, 'I do not know how to read (or what shall I read)?' Thereupon he caught me for the third time and pressed me, and then released me and said, 'Read in the name of your Lord, who has created (all that exists), created man from a clot. Read! And your Lord is the Most Generous."" (96.1, 96.2, 96.3) Then Allah's Apostle returned with the Inspiration and with his heart beating severely. Then he went to Khadija bint Khuwailid and said, ""Cover me! Cover me!"" They covered him till his fear was over and after that he told her everything that had happened and said, ""I fear that something may happen to me."" Khadija replied, ""Never! By Allah, Allah will never disgrace you. You keep good relations with your kith and kin, help the poor and the destitute, serve your guests generously and assist the deserving calamity-afflicted ones.""  Khadija then accompanied him to her cousin Waraqa bin Naufal bin Asad bin 'Abdul 'Uzza, who, during the pre-Islamic Period became a Christian and used to write the writing with Hebrew letters. He would write from the Gospel in Hebrew as much as Allah wished him to write. He was an old man and had lost his eyesight. Khadija said to Waraqa, ""Listen to the story of your nephew, O my cousin!"" Waraqa asked, ""O my nephew! What have you seen?"" Allah's Apostle described whatever he had seen. Waraqa said, ""This is the same one who keeps the secrets (angel Gabriel) whom Allah had sent to Moses. I wish I were young and could live up to the time when your people would turn you out."" Allah's Apostle asked, ""Will they drive me out?"" Waraqa replied in the affirmative and said, ""Anyone (man) who came with something similar to what you have brought was treated with hostility; and if I should remain alive till the day when you will be turned out then I would support you strongly."" But after a few days Waraqa died and the Divine Inspiration was also paused for a while."
Revelation - كتاب بدء الوحى,"11013, 10567, 34","قال ابن شهاب وأخبرني أبو سلمة بن عبد الرحمن، أن جابر بن عبد الله الأنصاري، قال  وهو يحدث عن فترة الوحى، فقال  في حديثه ‏""‏ بينا أنا أمشي، إذ سمعت صوتا، من السماء، فرفعت بصري فإذا الملك الذي جاءني بحراء جالس على كرسي بين السماء والأرض، فرعبت منه، فرجعت فقلت زملوني‏.‏ فأنزل الله تعالى ‏{‏يا أيها المدثر * قم فأنذر‏}‏ إلى قوله ‏{‏والرجز فاهجر‏}‏ فحمي الوحى وتتابع ‏""‏‏.‏ تابعه عبد الله بن يوسف وأبو صالح‏.‏ وتابعه هلال بن رداد عن الزهري‏.‏ وقال يونس ومعمر ‏""‏ بوادره ‏""‏‏.‏"," Narrated Jabir bin 'Abdullah Al-Ansari while talking about the period of pause in revelation reporting the speech of the Prophet ""While I was walking, all of a sudden I heard a voice from the sky. I looked up and saw the same angel who had visited me at the cave of Hira' sitting on a chair between the sky and the earth. I got afraid of him and came back home and said, 'Wrap me (in blankets).' And then Allah revealed the following Holy Verses (of Quran):                       'O you (i.e. Muhammad)! wrapped up in garments!' Arise and warn (the people against Allah's Punishment),... up to 'and desert the idols.' (74.1-5) After this the revelation started coming strongly, frequently and regularly."""
Revelation - كتاب بدء الوحى,"20040, 20469, 11399, 11050, 17",حدثنا موسى بن إسماعيل، قال حدثنا أبو عوانة، قال حدثنا موسى بن أبي عائشة، قال حدثنا سعيد بن جبير، عن ابن عباس، في قوله تعالى ‏{‏لا تحرك به لسانك لتعجل به‏}‏ قال كان رسول الله صلى الله عليه وسلم يعالج من التنزيل شدة، وكان مما يحرك شفتيه  فقال ابن عباس فأنا أحركهما لكم كما كان رسول الله صلى الله عليه وسلم يحركهما‏.‏ وقال سعيد أنا أحركهما كما رأيت ابن عباس يحركهما‏.‏ فحرك شفتيه  فأنزل الله تعالى ‏{‏لا تحرك به لسانك لتعجل به* إن علينا جمعه وقرآنه‏}‏ قال جمعه له في صدرك، وتقرأه ‏{‏فإذا قرأناه فاتبع قرآنه‏}‏ قال فاستمع له وأنصت ‏{‏ثم إن علينا بيانه‏}‏ ثم إن علينا أن تقرأه‏.‏ فكان رسول الله صلى الله عليه وسلم بعد ذلك إذا أتاه جبريل استمع، فإذا انطلق جبريل قرأه النبي صلى الله عليه وسلم كما قرأه‏.‏,"      Narrated Said bin Jubair:                          Ibn 'Abbas in the explanation of the statement of Allah ""Move not your tongue concerning (the Quran) to make haste therewith."" (75.16) said ""Allah's Apostle used to bear the revelation with great trouble and used to move his lips (quickly) with the Inspiration."" Ibn 'Abbas moved his lips saying, ""I am moving my lips in front of you as Allah's Apostle used to move his."" Said moved his lips saying: ""I am moving my lips, as I saw Ibn 'Abbas moving his."" Ibn 'Abbas added, ""So Allah revealed 'Move not your tongue concerning (the Qur'an) to make haste therewith. It is for Us to collect it and to give you (O Muhammad) the ability to recite it (the Quran)' (75.16-17) which means that Allah will make him (the Prophet) remember the portion of the Qur'an which was revealed at that time by heart and recite it. The statement of Allah: 'And when we have recited it to you (O Muhammad through Gabriel) then you follow its (Quran) recital' (75.18) means 'listen to it and be silent.' Then it is for Us (Allah) to make it clear to you' (75.19) means 'Then it is (for Allah) to make you recite it (and its meaning will be clear by itself through your tongue). Afterwards, Allah's Apostle used to listen to Gabriel whenever he came and after his departure he used to recite it as Gabriel had recited it."""
Revelation - كتاب بدء الوحى,"30349, 20025, 20475, 11013, 30318, 20025, 20475, 20115, 11013, 11004, 17",حدثنا عبدان، قال أخبرنا عبد الله، قال أخبرنا يونس، عن الزهري، ح وحدثنا بشر بن محمد، قال أخبرنا عبد الله، قال أخبرنا يونس، ومعمر، عن الزهري، نحوه قال أخبرني عبيد الله بن عبد الله، عن ابن عباس، قال كان رسول الله صلى الله عليه وسلم أجود الناس، وكان أجود ما يكون في رمضان حين يلقاه جبريل، وكان يلقاه في كل ليلة من رمضان فيدارسه القرآن، فلرسول الله صلى الله عليه وسلم أجود بالخير من الريح المرسلة‏.‏,"      Narrated Ibn 'Abbas:                          Allah's Apostle was the most generous of all the people, and he used      to reach the peak in generosity in the month of Ramadan when Gabriel      met him. Gabriel used to meet him every night of Ramadan to teach him      the Qur'an. Allah's Apostle was the most generous person, even more      generous than the strong uncontrollable wind (in readiness and haste      to do charitable deeds)."
