chapter,chain_indx,text_ar,text_en
Ablutions (Wudu') - كتاب الوضوء,"20423, 20160, 11062, 19",حدثنا خالد، قال حدثنا سليمان، عن يحيى بن سعيد، قال سمعت أنس بن مالك، قال جاء أعرابي فبال في طائفة المسجد، فزجره الناس، فنهاهم النبي صلى الله عليه وسلم، فلما قضى بوله أمر النبي صلى الله عليه وسلم بذنوب من ماء، فأهريق عليه‏.‏, Narrated Anas bin Malik:                     A Bedouin came and passed urine in one corner of the mosque. The people shouted at him but the Prophet stopped them till he finished urinating. The Prophet ordered them to spill a bucket of water over that place and they did so.
Ablutions (Wudu') - كتاب الوضوء,"30355, 20001, 11065, 10511, 53",حدثنا عبد الله بن يوسف، قال أخبرنا مالك، عن هشام بن عروة، عن أبيه، عن عائشة أم المؤمنين، أنها قالت أتي رسول الله صلى الله عليه وسلم بصبي، فبال على ثوبه، فدعا بماء فأتبعه إياه‏.‏, Narrated `Aisha:                     (the mother of faithful believers) A child was brought to Allah's Apostle and it urinated on the garment of the Prophet. The Prophet asked for water and poured it over the soiled place.
Ablutions (Wudu') - كتاب الوضوء,"30355, 20001, 11013, 11004, 827",حدثنا عبد الله بن يوسف، قال أخبرنا مالك، عن ابن شهاب، عن عبيد الله بن عبد الله بن عتبة، عن أم قيس بنت محصن، أنها أتت بابن لها صغير، لم يأكل الطعام إلى رسول الله صلى الله عليه وسلم، فأجلسه رسول الله صلى الله عليه وسلم في حجره، فبال على ثوبه، فدعا بماء فنضحه ولم يغسله‏.‏," Narrated Um Qais bint Mihsin:                     I brought my young son, who had not started eating (ordinary food) to Allah's Apostle who took him and made him sit in his lap. The child urinated on the garment of the Prophet, so he asked for water and poured it over the soiled (area) and did not wash it."
Ablutions (Wudu') - كتاب الوضوء,"20404, 20020, 11060, 11353, 145",حدثنا آدم، قال حدثنا شعبة، عن الأعمش، عن أبي وائل، عن حذيفة، قال أتى النبي صلى الله عليه وسلم سباطة قوم فبال قائما، ثم دعا بماء، فجئته بماء فتوضأ‏.‏, Narrated Hudhaifa:                     Once the Prophet went to the dumps of some people and passed urine while standing. He then asked for water and so I brought it to him and he performed ablution.
Ablutions (Wudu') - كتاب الوضوء,"30203, 20028, 11067, 11353, 145",حدثنا عثمان بن أبي شيبة، قال حدثنا جرير، عن منصور، عن أبي وائل، عن حذيفة، قال رأيتني أنا والنبي، صلى الله عليه وسلم نتماشى، فأتى سباطة قوم خلف حائط، فقام كما يقوم أحدكم فبال، فانتبذت منه، فأشار إلى فجئته، فقمت عند عقبه حتى فرغ‏.‏," Narrated Hudhaifa':                     The Prophet and I walked till we reached the dumps of some people. He stood, as any one of you stands, behind a wall and urinated. I went away, but he beckoned me to come. So I approached him and stood near his back till he finished."
Ablutions (Wudu') - كتاب الوضوء,"20282, 20020, 11067, 11353, 41",حدثنا محمد بن عرعرة، قال حدثنا شعبة، عن منصور، عن أبي وائل، قال كان أبو موسى الأشعري يشدد في البول ويقول إن بني إسرائيل كان إذا أصاب ثوب أحدهم قرضه‏.‏ فقال حذيفة ليته أمسك، أتى رسول الله صلى الله عليه وسلم سباطة قوم فبال قائما‏.‏," Narrated Abu Wail:                     Abu Musa Al-Ash`ari used to lay great stress on the question of urination and he used to say, ""If anyone from Bani Israel happened to soil his clothes with urine, he used to cut that portion away."" Hearing that, Hudhaifa said to Abu Wail, ""I wish he (Abu Musa) didn't (lay great stress on that matter)."" Hudhaifa added, ""Allah's Apostle went to the dumps of some people and urinated while standing."""
Ablutions (Wudu') - كتاب الوضوء,"30170, 20031, 11065, 10526, 70","حدثنا محمد بن المثنى، قال حدثنا يحيى، عن هشام، قال حدثتني فاطمة، عن أسماء، قالت جاءت امرأة النبي صلى الله عليه وسلم فقالت أرأيت إحدانا تحيض في الثوب كيف تصنع قال ‏""‏ تحته، ثم تقرصه بالماء، وتنضحه وتصلي فيه ‏""‏‏.‏"," Narrated Asma':                     A woman came to the Prophet and said, ""If anyone of us gets menses in her clothes then what should she do?"" He replied, ""She should (take hold of the soiled place), rub it and put it in the water and rub it in order to remove the traces of blood and then pour water over it. Then she can pray in it."""
Ablutions (Wudu') - كتاب الوضوء,"30213, 20354, 11065, 10511, 53","حدثنا محمد، قال حدثنا أبو معاوية، حدثنا هشام بن عروة، عن أبيه، عن عائشة، قالت جاءت فاطمة ابنة أبي حبيش إلى النبي صلى الله عليه وسلم فقالت يا رسول الله إني امرأة أستحاض فلا أطهر، أفأدع الصلاة فقال رسول الله صلى الله عليه وسلم ‏""‏ لا، إنما ذلك عرق، وليس بحيض، فإذا أقبلت حيضتك فدعي الصلاة، وإذا أدبرت فاغسلي عنك الدم ثم صلي ‏""‏‏.‏ قال وقال أبي ‏""‏ ثم توضئي لكل صلاة، حتى يجيء ذلك الوقت ‏""‏‏.‏"," Narrated `Aisha:                     Fatima bint Abi Hubaish came to the Prophet and said, ""O Allah's Apostle I get persistent bleeding from the uterus and do not become clean. Shall I give up my prayers?"" Allah's Apostle replied, ""No, because it is from a blood vessel and not the menses. So when your real menses begins give up your prayers and when it has finished wash off the blood (take a bath) and offer your prayers."" Hisham (the sub narrator) narrated that his father had also said, (the Prophet told her): ""Perform ablution for every prayer till the time of the next period comes."""
Ablutions (Wudu') - كتاب الوضوء,"30349, 20025, 11439, 11005, 53",حدثنا عبدان، قال أخبرنا عبد الله، قال أخبرنا عمرو بن ميمون الجزري، عن سليمان بن يسار، عن عائشة، قالت كنت أغسل الجنابة من ثوب النبي صلى الله عليه وسلم، فيخرج إلى الصلاة، وإن بقع الماء في ثوبه‏.‏, Narrated `Aisha:                     I used to wash the traces of Janaba (semen) from the clothes of the Prophet and he used to go for prayers while traces of water were still on it (water spots were still visible).
Ablutions (Wudu') - كتاب الوضوء,"30367, 20304, 11439, 11005, 53, 30175, 20256, 11439, 11005, 53",حدثنا قتيبة، قال حدثنا يزيد، قال حدثنا عمرو، عن سليمان، قال سمعت عائشة، ح وحدثنا مسدد، قال حدثنا عبد الواحد، قال حدثنا عمرو بن ميمون، عن سليمان بن يسار، قال سألت عائشة عن المني، يصيب الثوب فقالت كنت أغسله من ثوب رسول الله صلى الله عليه وسلم، فيخرج إلى الصلاة وأثر الغسل في ثوبه بقع الماء‏.‏, Narrated `Aisha:                     as above (229).
Ablutions (Wudu') - كتاب الوضوء,"20040, 20256, 11439, 11005",حدثنا موسى، قال حدثنا عبد الواحد، قال حدثنا عمرو بن ميمون، قال سألت سليمان بن يسار في الثوب تصيبه الجنابة قال قالت عائشة كنت أغسله من ثوب رسول الله صلى الله عليه وسلم، ثم يخرج إلى الصلاة وأثر الغسل فيه بقع الماء‏.‏," Narrated Sulaiman bin Yasar:                     I asked `Aisha about the clothes soiled with semen. She replied, ""I used to wash it off the clothes of Allah's Apostle and he would go for the prayer while water spots were still visible. """
Ablutions (Wudu') - كتاب الوضوء,"30237, 20321, 11439, 11005, 53",حدثنا عمرو بن خالد، قال حدثنا زهير، قال حدثنا عمرو بن ميمون بن مهران، عن سليمان بن يسار، عن عائشة، أنها كانت تغسل المني من ثوب النبي صلى الله عليه وسلم، ثم أراه فيه بقعة أو بقعا‏.‏," Narrated `Amr bin Maimun:                     I heard Sulaiman bin Yasar talking about the clothes soiled with semen. He said that `Aisha had said, ""I used to wash it off the clothes of Allah's Apostle and he would go for the prayers while water spots were still visible on them."
Ablutions (Wudu') - كتاب الوضوء,"20193, 20022, 11015, 11047, 19",حدثنا سليمان بن حرب، قال حدثنا حماد بن زيد، عن أيوب، عن أبي قلابة، عن أنس، قال قدم أناس من عكل أو عرينة، فاجتووا المدينة، فأمرهم النبي صلى الله عليه وسلم بلقاح، وأن يشربوا من أبوالها وألبانها، فانطلقوا، فلما صحوا قتلوا راعي النبي صلى الله عليه وسلم واستاقوا النعم، فجاء الخبر في أول النهار، فبعث في آثارهم، فلما ارتفع النهار جيء بهم، فأمر فقطع أيديهم وأرجلهم، وسمرت أعينهم، وألقوا في الحرة يستسقون فلا يسقون‏.‏ قال أبو قلابة فهؤلاء سرقوا وقتلوا وكفروا بعد إيمانهم، وحاربوا الله ورسوله‏.‏," Narrated Abu Qilaba:                     Anas said, ""Some people of `Ukl or `Uraina tribe came to Medina and its climate did not suit them. So the Prophet ordered them to go to the herd of (Milch) camels and to drink their milk and urine (as a medicine). So they went as directed and after they became healthy, they killed the shepherd of the Prophet and drove away all the camels. The news reached the Prophet early in the morning and he sent (men) in their pursuit and they were captured and brought at noon. He then ordered to cut their hands and feet (and it was done), and their eyes were branded with heated pieces of iron, They were put in 'Al-Harra' and when they asked for water, no water was given to them."" Abu Qilaba said, ""Those people committed theft and murder, became infidels after embracing Islam and fought against Allah and His Apostle ."""
Ablutions (Wudu') - كتاب الوضوء,"20404, 20020, 11317, 19",حدثنا آدم، قال حدثنا شعبة، قال أخبرنا أبو التياح، يزيد بن حميد عن أنس، قال كان النبي صلى الله عليه وسلم يصلي قبل أن يبنى المسجد في مرابض الغنم‏.‏," Narrated Anas:                     Prior to the construction of the mosque, the Prophet offered the prayers at sheep-folds."
Ablutions (Wudu') - كتاب الوضوء,"30103, 20001, 11013, 11004, 17, 61","حدثنا إسماعيل، قال حدثني مالك، عن ابن شهاب، عن عبيد الله بن عبد الله، عن ابن عباس، عن ميمونة، أن رسول الله صلى الله عليه وسلم سئل عن فأرة سقطت في سمن فقال ‏""‏ ألقوها وما حولها فاطرحوه‏.‏ وكلوا سمنكم ‏""‏‏.‏"," Narrated Maimuna:                     Allah's Apostle was asked regarding ghee (cooking butter) in which a mouse had fallen. He said, ""Take out the mouse and throw away the ghee around it and use the rest."""
Ablutions (Wudu') - كتاب الوضوء,"30026, 30112, 20001, 11013, 11004, 17, 61","حدثنا علي بن عبد الله، قال حدثنا معن، قال حدثنا مالك، عن ابن شهاب، عن عبيد الله بن عبد الله بن عتبة بن مسعود، عن ابن عباس، عن ميمونة، أن النبي صلى الله عليه وسلم سئل عن فأرة سقطت في سمن فقال ‏""‏ خذوها وما حولها فاطرحوه ‏""‏‏.‏ قال معن حدثنا مالك ما لا أحصيه يقول عن ابن عباس عن ميمونة‏.‏"," Narrated Maimuna:                     The Prophet was asked regarding ghee in which a mouse had fallen. He said, ""Take out the mouse and throw away the ghee around it (and use the rest.)"""
Ablutions (Wudu') - كتاب الوضوء,"30304, 20025, 20115, 11447, 13","حدثنا أحمد بن محمد، قال أخبرنا عبد الله، قال أخبرنا معمر، عن همام بن منبه، عن أبي هريرة، عن النبي صلى الله عليه وسلم قال ‏""‏ كل كلم يكلمه المسلم في سبيل الله يكون يوم القيامة كهيئتها إذ طعنت، تفجر دما، اللون لون الدم، والعرف عرف المسك ‏""‏‏.‏"," Narrated Abu Huraira:                     The Prophet said, ""A wound which a Muslim receives in Allah's cause will appear on the Day of Resurrection as it was at the time of infliction; blood will be flowing from the wound and its color will be that of the blood but will smell like musk."""
Ablutions (Wudu') - كتاب الوضوء,"30330, 20428, 11061, 11197, 13","حدثنا أبو اليمان، قال أخبرنا شعيب، قال أخبرنا أبو الزناد، أن عبد الرحمن بن هرمز الأعرج، حدثه أنه، سمع أبا هريرة، أنه سمع رسول الله صلى الله عليه وسلم يقول ‏""‏ نحن الآخرون السابقون ‏""‏‏.‏"," Narrated Abu Huraira:                     Allah's Apostle said, ""We (Muslims) are the last (people to come in the world) but (will be) the foremost (on the Day of Resurrection)."" The same narrator told that the Prophet had said, ""You should not pass urine in stagnant water which is not flowing then (you may need to) wash in it."""
Ablutions (Wudu') - كتاب الوضوء,,"وبإسناده قال ‏""‏ لا يبولن أحدكم في الماء الدائم الذي لا يجري، ثم يغتسل فيه ‏""‏‏.‏", Narrated `Abdullah:                     While Allah's Apostle was prostrating (as stated below).
Ablutions (Wudu') - كتاب الوضوء,"30349, 30361, 20020, 11049, 11382, 16","حدثنا عبدان، قال أخبرني أبي، عن شعبة، عن أبي إسحاق، عن عمرو بن ميمون، عن عبد الله، قال بينا رسول الله صلى الله عليه وسلم ساجد ح قال وحدثني أحمد بن عثمان قال حدثنا شريح بن مسلمة قال حدثنا إبراهيم بن يوسف عن أبيه عن أبي إسحاق قال حدثني عمرو بن ميمون أن عبد الله بن مسعود حدثه أن النبي صلى الله عليه وسلم كان يصلي عند البيت، وأبو جهل وأصحاب له جلوس، إذ قال بعضهم لبعض أيكم يجيء بسلى جزور بني فلان فيضعه على ظهر محمد إذا سجد فانبعث أشقى القوم فجاء به، فنظر حتى إذا سجد النبي صلى الله عليه وسلم وضعه على ظهره بين كتفيه وأنا أنظر، لا أغير شيئا، لو كان لي منعة‏.‏ قال فجعلوا يضحكون ويحيل بعضهم على بعض، ورسول الله صلى الله عليه وسلم ساجد لا يرفع رأسه، حتى جاءته فاطمة، فطرحت عن ظهره، فرفع رأسه ثم قال ‏""‏ اللهم عليك بقريش ‏""‏‏.‏ ثلاث مرات، فشق عليهم إذ دعا عليهم  قال وكانوا يرون أن الدعوة في ذلك البلد مستجابة  ثم سمى ‏""‏ اللهم عليك بأبي جهل، وعليك بعتبة بن ربيعة، وشيبة بن ربيعة، والوليد بن عتبة، وأمية بن خلف، وعقبة بن أبي معيط ‏""‏‏.‏ وعد السابع فلم يحفظه قال فوالذي نفسي بيده، لقد رأيت الذين عد رسول الله صلى الله عليه وسلم صرعى في القليب قليب بدر‏.‏"," Narrated `Abdullah bin Mas`ud:                     Once the Prophet was offering prayers at the Ka`ba. Abu Jahl was sitting with some of his companions. One of them said to the others, ""Who amongst you will bring the Abdominal contents (intestines, etc.) of a camel of Bani so and so and put it on the back of Muhammad, when he prostrates?"" The most unfortunate of them got up and brought it. He waited till the Prophet prostrated and then placed it on his back between his shoulders. I was watching but could not do any thing. I wish I had some people with me to hold out against them. They started laughing and falling on one another. Allah's Apostle was in prostration and he did not lift his head up till Fatima (Prophet's daughter) came and threw that (camel's Abdominal contents) away from his back. He raised his head and said thrice, ""O Allah! Punish Quraish."" So it was hard for Abu Jahl and his companions when the Prophet invoked Allah against them as they had a conviction that the prayers and invocations were accepted in this city (Mecca). The Prophet said, ""O Allah! Punish Abu Jahl, `Utba bin Rabi`a, Shaiba bin Rabi`a, Al-Walid bin `Utba, Umaiya bin Khalaf, and `Uqba bin Al Mu'it [??] (and he mentioned the seventh whose name I cannot recall). By Allah in Whose Hands my life is, I saw the dead bodies of those persons who were counted by Allah's Apostle in the Qalib (one of the wells) of Badr."
Ablutions (Wudu') - كتاب الوضوء,"30388, 20005, 11279, 19",حدثنا محمد بن يوسف، قال حدثنا سفيان، عن حميد، عن أنس، قال بزق النبي صلى الله عليه وسلم في ثوبه‏.‏ طوله ابن أبي مريم قال أخبرنا يحيى بن أيوب حدثني حميد قال سمعت أنسا عن النبي صلى الله عليه وسلم‏.‏, Narrated Anas:                     The Prophet once spat in his clothes.
Ablutions (Wudu') - كتاب الوضوء,"30026, 20005, 11013, 10567, 53","حدثنا علي بن عبد الله، قال حدثنا سفيان، قال حدثنا الزهري، عن أبي سلمة، عن عائشة، عن النبي صلى الله عليه وسلم قال ‏""‏ كل شراب أسكر فهو حرام ‏""‏‏.‏"," Narrated Aisha:                     The Prophet said, ""All drinks that produce intoxication are Haram (forbidden to drink)."
Ablutions (Wudu') - كتاب الوضوء,"30213, 20005, 11172, 399",حدثنا محمد، قال أخبرنا سفيان بن عيينة، عن أبي حازم، سمع سهل بن سعد الساعدي،، وسأله الناس، وما بيني وبينه أحد بأى شىء دووي جرح النبي صلى الله عليه وسلم فقال ما بقي أحد أعلم به مني، كان علي يجيء بترسه فيه ماء، وفاطمة تغسل عن وجهه الدم، فأخذ حصير فأحرق فحشي به جرحه‏.‏," Narrated Abu Hazim:                     Sahl bin Sa`d As-Sa`idi, was asked by the people, ""With what was the wound of the Prophet treated? Sahl replied, ""None remains among the people living who knows that better than I. `Ali [??] used to bring water in his shield and Fatima used to wash the blood off his face. Then straw mat was burnt and the wound was filled with it."""
Ablutions (Wudu') - كتاب الوضوء,"20283, 20022, 11300, 11901, 41","حدثنا أبو النعمان، قال حدثنا حماد بن زيد، عن غيلان بن جرير، عن أبي بردة، عن أبيه، قال أتيت النبي صلى الله عليه وسلم فوجدته يستن بسواك بيده يقول ‏""‏ أع أع ‏""‏، والسواك في فيه، كأنه يتهوع‏.‏"," Narrated Abu Burda:                     My father said, ""I came to the Prophet and saw him carrying a Siwak in his hand and cleansing his teeth, saying, 'U' U',"" as if he was retching while the Siwak was in his mouth."""
Ablutions (Wudu') - كتاب الوضوء,"30203, 20028, 11067, 11353, 145",حدثنا عثمان، قال حدثنا جرير، عن منصور، عن أبي وائل، عن حذيفة، قال كان النبي صلى الله عليه وسلم إذا قام من الليل يشوص فاه بالسواك‏.‏," Narrated Hudhaifa:                     Whenever the Prophet got up at night, he used to clean his mouth with Siwak."
Ablutions (Wudu') - كتاب الوضوء,"30106, 20429, 11014, 18","وقال عفان حدثنا صخر بن جويرية، عن نافع، عن ابن عمر، أن النبي صلى الله عليه وسلم قال ‏""‏ أراني أتسوك بسواك، فجاءني رجلان أحدهما أكبر من الآخر، فناولت السواك الأصغر منهما، فقيل لي كبر‏.‏ فدفعته إلى الأكبر منهما ‏""‏‏.‏ قال أبو عبد الله اختصره نعيم عن ابن المبارك عن أسامة عن نافع عن ابن عمر‏.‏"," Narrated Ibn 'Umar:                      The Prophet () said, ""I dreamt that I was cleaning my teeth with a Siwak and two persons came to me. One of them was older than the other and I gave the Siwak to the younger. I was told that I should give it to the older and so I did."""
Ablutions (Wudu') - كتاب الوضوء,"30118, 20025, 20012, 11067, 11344, 400","حدثنا محمد بن مقاتل، قال أخبرنا عبد الله، قال أخبرنا سفيان، عن منصور، عن سعد بن عبيدة، عن البراء بن عازب، قال قال النبي صلى الله عليه وسلم ‏""‏ إذا أتيت مضجعك فتوضأ وضوءك للصلاة، ثم اضطجع على شقك الأيمن، ثم قل اللهم أسلمت وجهي إليك، وفوضت أمري إليك، وألجأت ظهري إليك، رغبة ورهبة إليك، لا ملجأ ولا منجا منك إلا إليك، اللهم آمنت بكتابك الذي أنزلت، وبنبيك الذي أرسلت‏.‏ فإن مت من ليلتك فأنت على الفطرة، واجعلهن آخر ما تتكلم به ‏""‏‏.‏ قال فرددتها على النبي صلى الله عليه وسلم فلما بلغت ‏""‏ اللهم آمنت بكتابك الذي أنزلت ‏""‏‏.‏ قلت ورسولك‏.‏ قال ‏""‏ لا، ونبيك الذي أرسلت ‏""‏‏.‏"," Narrated Al-Bara 'bin `Azib:                     The Prophet said to me, ""Whenever you go to bed perform ablution like that for the prayer, lie or your right side and say, ""Allahumma aslamtu wajhi ilaika, wa fauwadtu `Amri ilaika, wa alja'tu Zahri ilaika raghbatan wa rahbatan ilaika. La Malja'a wa la manja minka illa ilaika. Allahumma amantu bikitabika-l-ladhi anzalta wa bina-biyika-l ladhi arsalta"" (O Allah! I surrender to You and entrust all my affairs to You and depend upon You for Your Blessings both with hope and fear of You. There is no fleeing from You, and there is no place of protection and safety except with You O Allah! I believe in Your Book (the Qur'an) which You have revealed and in Your Prophet (Muhammad) whom You have sent). Then if you die on that very night, you will die with faith (i.e. or the religion of Islam). Let the aforesaid words be your last utterance (before sleep)."" I repeated it before the Prophet and when I reached ""Allahumma amantu bikitabika-l-ladhi anzalta (O Allah I believe in Your Book which You have revealed)."" I said, ""Wa-rasulika (and your Apostle)."" The Prophet said, ""No, (but say): 'Wanabiyika-l-ladhi arsalta (Your Prophet whom You have sent), instead."""
Bathing (Ghusl) - كتاب الغسل,"30355, 20001, 11065, 10511, 53",حدثنا عبد الله بن يوسف، قال أخبرنا مالك، عن هشام، عن أبيه، عن عائشة، زوج النبي صلى الله عليه وسلم أن النبي صلى الله عليه وسلم كان إذا اغتسل من الجنابة بدأ فغسل يديه، ثم يتوضأ كما يتوضأ للصلاة، ثم يدخل أصابعه في الماء، فيخلل بها أصول شعره ثم يصب على رأسه ثلاث غرف بيديه، ثم يفيض الماء على جلده كله‏.‏," Narrated `Aisha:                     Whenever the Prophet took a bath after Janaba he started by washing his hands and then performed ablution like that for the prayer. After that he would put his fingers in water and move the roots of his hair with them, and then pour three handfuls of water over his head and then pour water all over his body."
